Chart,Scale,Title
11006,875000,Gulf Coast - Key West to Mississippi River
11009,1200000,Cape Hatteras to Straits of Florida
11013,1200000,Straits of Florida and Approaches
1113A,470940,Havana to Tampa Bay (Oil and Gas Leasing Areas)
1114A,456394,Tampa Bay to Cape San Blas (Oil and Gas Leasing Areas)
1115A,456394,Cape St. George to Mississippi Passes (Oil and Gas Leasing Areas)
1116A,458596,Mississippi River to Galveston (Oil and Gas Leasing Areas)
1117A,460732,Galveston to Rio Grande (Oil and Gas Leasing Areas)
11300,460732,Galveston to Rio Grande
11301,80000,Southern part of Laguna Madre
11302,40000,"Intracoastal Waterway Stover Point to Port Brownsville, including Brazos Santiago Pass"
11303,40000,"Intracoastal Waterway Laguna Madre - Chubby Island to Stover Point, including The Arroyo Colorado"
11304,80000,Northern part of Laguna Madre
11306,40000,Intracoastal Waterway Laguna Madre Middle Ground to Chubby Island
11307,80000,Aransas Pass to Baffin Bay
11308,40000,Intracoastal Waterway Redfish Bay to Middle Ground
11309,40000,Corpus Christi Bay
11311,10000,Corpus Christi Harbor
11312,20000,Corpus Christi Bay - Port Aransas to Port Ingleside
11313,80000,Matagorda Light to Aransas Pass
11314,40000,"Intracoastal Waterway Carlos Bay to Redfish Bay, including Copano Bay"
11315,40000,Intracoastal Waterway Espiritu Santo Bay to Carlos Bay including San Antonio Bay and Victoria Barge Canal
11316,80000,Matagorda Bay and approaches
11317,50000,Matagorda Bay including Lavaca and Tres Palacios Bays; Port Lavaca; Continuation of Lavaca River; Continuation of Tres Palacios Bay
11319,40000,Intracoastal Waterway Cedar Lakes to Espiritu Santo Bay
11321,80000,San Luis Pass to East Matagorda Bay
11322,40000,Intracoastal Waterway Galveston Bay to Cedar Lakes
11323,80000,Approaches to Galveston Bay
11324,25000,Galveston Bay Entrance Galveston and Texas City Harbors
11325,10000,Houston Ship Channel Carpenters Bayou to Houston
11326,80000,Galveston Bay
11327,25000,Upper Galveston Bay-Houston Ship Channel-Dollar Pt. to Atkinson
11328,10000,Houston Ship Channel Atkinson Island to Alexander Island
11329,25000,Houston Ship Channel Alexander Island to Carpenters Bayou;San Jacinto and Old Rivers
11330,250000,Mermentau River to Freeport
11331,40000,Intracoastal Waterway Ellender to Galveston Bay
11332,80000,Sabine Bank
11339,50000,Calcasieu River and Approaches
11340,458596,Mississippi River to Galveston
11341,80000,Calcasieu Pass to Sabine Pass
11342,40000,Sabine Pass and Lake
11343,40000,Sabine and Neches Rivers
11344,80000,Rollover Bayou to Calcasieu Pass
11345,175000,Intracoastal Waterway New Orleans to Calcasieu River West Section
11346,20000,Port Fourchon and Approaches
11347,50000,Calcasieu River and Lake
11348,40000,"Intracoastal Waterway Forked Island to Ellender, including the Mermantau River, Grand Lake and White Lake"
11349,80000,Vermilion Bay and approaches
11350,40000,"Intracoastal Waterway Wax Lake Outlet to Forked Island including Bayou Teche, Vermilion River, and Freshwater Bayou"
11351,80000,Point au Fer to Marsh Island
11352,175000,Intracoastal Waterway New Orleans to Calcasieu River East Section
11353,40000,Baptiste Collette Bayou to Mississippi River Gulf Outlet;Baptiste Collette Bayou Extension
11354,80000,"Intracoastal Waterway Morgan City to Port Allen, including the Atchafalaya River"
11355,40000,Intracoastal Waterway Catahoula Bay to Wax Lake Outlet including the Houma Navigation canal
11356,80000,Isles Dernieres to Point au Fer
11357,80000,Timbalier and Terrebonne Bays
11358,80000,Barataria Bay and approaches
11359,50000,Loop Deepwater Port Louisiana Offshore Oil Port
11360,456394,Cape St. George to Mississippi Passes
11361,80000,Mississippi River Delta;Southwest Pass;South Pass;Head of Passes
11363,80000,Chandeleur and Breton Sounds
11364,80000,Mississippi River-Venice to New Orleans
11365,50000,Barataria and Bayou Lafourche Waterways Intracoastal Waterway to Gulf of Mexico
11366,250000,Approaches to Mississippi River
11367,40000,Intracoastal Waterway Waveland to Catahoula Bay
11368,15000,New Orleans Harbor Chalmette Slip to Southport
11369,80000,Lakes Pontchartrain and Maurepas
11370,40000,Mississippi River-New Orleans to Baton Rouge
11371,80000,Lake Borgne and approaches Cat Island to Point aux Herbes
11372,40000,Intracoastal Waterway Dog Keys Pass to Waveland
11373,80000,Mississippi Sound and approaches Dauphin Island to Cat Island
11374,40000,Intracoastal Waterway Dauphin Island to Dog Keys Pass
11375,20000,Pascagoula Harbor
11376,80000,Mobile Bay Mobile Ship Channel-Northern End
11377,40000,Mobile Bay Approaches and Lower Half
11378,40000,Intracoastal Waterway Santa Rosa Sound to Dauphin Island
11380,20000,Mobile Bay East Fowl River to Deer River Pt; Mobile Middle Bay Terminal
11382,80000,Pensacola Bay and approaches
11383,30000,Pensacola Bay
11384,10000,Pensacola Bay Entrance
11385,40000,Intracoastal Waterway West Bay to Santa Rosa Sound
11388,80000,Choctawhatchee Bay
11389,80000,St Joseph and St Andrew Bays
11390,40000,Intracoastal Waterway East Bay to West Bay
11391,25000,St. Andrew Bay
11392,5000,St. Andrew Bay - Bear Point to Sulpher Point
11393,40000,Intracoastal Waterway Lake Wimico to East Bay
11400,456394,Tampa Bay to Cape San Blas
11401,80000,Apalachicola Bay to Cape San Blas
11402,40000,Intracoastal Waterway Apalachicola Bay to Lake Wimico
11404,40000,Intracoastal Waterway Carrabelle to Apalachicola Bay;Carrabelle River
11405,80000,Apalachee Bay
11406,15000,St.Marks River and approaches
11407,80000,Horseshoe Point to Rock Islands;Horseshoe Beach
11408,80000,Crystal River to Horseshoe Point;Suwannee River;Cedar Keys
11409,80000,Anclote Keys to Crystal River
11411,40000,Intracoastal Waterway Tampa Bay to Port Richey
11412,80000,Tampa Bay and St. Joseph Sound
11415,40000,Tampa Bay Entrance; Manatee River Extension
11416,40000,Tampa Bay;Safety Harbor;St. Petersburg;Tampa
11420,470940,Havana to Tampa Bay
11424,80000,Lemon Bay to Passage Key Inlet
11425,40000,Intracoastal Waterway Charlotte Harbor to Tampa Bay
11426,80000,"Estero Bay to Lemon Bay, including Charlotte Harbor;Continuation of Peace River"
11427,40000,Intracoastal Waterway Fort Myers to Charlotte Harbor and Wiggins Pass
11428,40000,Okeechobee Waterway St. Lucie Inlet to Fort Myers; Lake Okeechobee
11429,80000,Chatham River to Clam Pass;Naples Bay;Everglades Harbor
11430,40000,Lostmans River to Wiggins Pass
11431,80000,East Cape to Mormon Key
11432,50000,Everglades National Park Shark River to Lostmans River
11433,50000,Everglades National Park Whitewater Bay
11434,180000,Florida Keys Sombrero Key to Dry Tortugas
11438,30000,Dry Tortugas;Tortugas Harbor
11439,80000,Sand Key to Rebecca Shoal
11441,30000,Key West Harbor and Approaches
11442,80000,Florida Keys Sombrero Key to Sand Key
11445,40000,Intracoastal Waterway Bahia Honda Key to Sugarloaf Key
11446,40000,Intracoastal Waterway Sugarloaf Key To Key West
11447,10000,Key West Harbor
11448,40000,Intracoastal Waterway Big Spanish Channel to Johnston Key
11449,40000,Intracoastal Waterway Matecumbe to Grassy Key
11450,180000,Fowey Rocks to American Shoal
11451,80000,Miami to Marathon and Florida Bay
11452,80000,Intracoastal Waterway Alligator Reef to Sombrero Key
11453,40000,Florida Keys Grassy Key to Bahia Honda Key
11459,40000,Port of Palm Beach and Approaches
11460,466940,Cape Canaveral to Key West
11462,80000,Fowey Rocks to Alligator Reef
11463,40000,Intracoastal Waterway Sands Key to Blackwater Sound
11464,40000,Intracoastal Waterway Blackwater Sound To Matecumbe
11465,40000,Intracoastal Waterway Miami to Elliot Key
11466,80000,Jupiter Inlet to Fowey Rocks;Lake Worth Inlet
11467,40000,Intracoastal Waterway West Palm Beach to Miami
11468,12000,Miami Harbor
11469,100000,"Straits of Florida Fowey Rocks, Hillsboro Inlet to Bimini Islands, Bahamas"
11470,10000,Fort Lauderdale Port Everglades 
11472,40000,Intracoastal Waterway Palm Shores to West Palm Beach;Loxahatchee River
11474,80000,Bethel Shoal to Jupiter Inlet
11475,10000,Fort Pierce Harbor
11476,80000,Cape Canaveral to Bethel Shoal
11478,10000,Port Canaveral;Canaveral Barge Canal Extension
11480,449659,Charleston Light to Cape Canaveral
11481,25000,Approaches to Port Canaveral
11484,80000,Ponce de Leon Inlet to Cape Canaveral
11485,40000,Intracoastal Waterway Tolomato River to Palm Shores
11486,80000,St. Augustine Light to Ponce de Leon Inlet
11487,40000,St. Johns River Racy Point to Crescent Lake
11488,80000,Amelia Island to St. Augustine
11489,40000,Intracoastal Waterway St. Simons Sound to Tolomato River
11490,40000,Approaches to St. Johns River;St. Johns River Entrance
11491,20000,St. Johns River-Atlantic Ocean to Jacksonville
11492,40000,St. John's River Jacksonville to Racy Point
11495,40000,St. Johns River Dunns Creek to Lake Dexter
11498,40000,St. Johns River Lake Dexter to Lake Harney
11502,80000,Doboy Sound to Fernadina
11503,25000,St. Marys Entrance Cumberland Sound and Kings Bay
11504,40000,St. Andrew Sound and Satilla River
11505,40000,Savannah River Approach
11506,40000,"St. Simons Sound, Brunswick Harbor and Turtle River"
11507,40000,Intracoastal Waterway Beaufort River to St. Simons Sound
11508,40000,Altamaha Sound
11509,80000,Tybee Island to Doboy Sound
11510,40000,Sapelo and Doboy Sounds
11511,40000,Ossabaw and St. Catherines Sounds 
11512,40000,Savannah River and Wassaw Sound
11513,80000,St. Helena Sound to Savannah River
11514,20000,Savannah River Savannah to Brier Creek
11515,20000,Savannah River Brier Creek to Augusta
11516,40000,Port Royal Sound and Inland Passages
11517,40000,St. Helena Sound
11518,40000,Intracoastal Waterway Casino Creek to Beaufort River
11519,40000,Parts of Coosaw and Broad Rivers
11520,432720,Cape Hatteras to Charleston
11521,80000,Charleston Harbor and Approaches
11522,40000,Stono and North Edisto Rivers
11524,20000,Charleston Harbor
11526,20000,Wando River Upper Part
11527,20000,Cooper River Above Goose Creek
11528,40000,Charleston Harbor Entrance and Approach
11531,80000,Winyah Bay to Bulls Bay
11532,40000,Winyah Bay
11534,40000,Intracoastal Waterway Myrtle Grove Sound and Cape Fear River to Casino Creek
11535,80000,Little River lnlet to Winyah Bay Entrance
11536,80000,Approaches to Cape Fear River
11537,40000,Cape Fear River Cape Fear to Wilmington
11539,80000,New River Inlet to Cape Fear
11541,40000,Intracoastal Waterway Neuse River to Myrtle Grove Sound
11542,40000,New River;Jacksonville
11543,80000,Cape Lookout to New River
11544,80000,"Portsmouth Island to Beaufort, Including Cape Lookout Shoals"
11545,40000,Beaufort Inlet and Part of Core Sound;Lookout Bight
11547,15000,Morehead City Harbor
11548,80000,Pamlico Sound Western Part
11550,40000,Ocracoke lnlet and Part of Core Sound
11552,40000,Neuse River and Upper Part of Bay River
11553,40000,Intracoastal Waterway Albermarle Sound to Neuse River;Alligator River;Second Creek
11554,40000,Pamlico River
11555,80000,Cape Hatteras-Wimble Shoals to Ocracoke Inlet
12200,419706,Cape May to Cape Hatteras
12204,80000,Currituck Beach Light to Wimble Shoals
12205,80000,"Cape Henry to Pamlico Sound, Including Albemarle Sd.; Rudee Heights"
12206,40000,Intracoastal Waterway Norfolk to Albemarle Sound via North Landing River or Great Dismal Swamp Canal
12207,80000,Cape Henry to Currituck Beach Light
12208,50000,Approaches to Chesapeake Bay
12210,80000,Chincoteague Inlet to Great Machipongo Inlet;Chincoteague Inlet
12211,80000,Fenwick Island to Chincoteague Inlet;Ocean City Inlet
12214,80000,Cape May to Fenwick Island
12216,40000,Cape Henlopen to Indian River Inlet;Breakwater Harbor
12221,80000,Chesapeake Bay Entrance
12222,40000,Chesapeake Bay Cape Charles to Norfolk Harbor
12224,40000,Chesapeake Bay Cape Charles to Wolf Trap
12225,80000,Chesapeake Bay Wolf Trap to Smith Point
12226,40000,Chesapeake Bay Wolf Trap to Pungoteague Creek
12228,40000,Chesapeake Bay Pocomoke and Tangier Sounds
12230,80000,Chesapeake Bay Smith Point to Cove Point
12231,40000,Chesapeake Bay Tangier Sound Northern Part
12233,40000,Potomac River Chesapeake Bay to Piney Point
12235,40000,"Chesapeake Bay Rappahannock River Entrance, Piankatank and Great Wicomico Rivers"
12237,40000,Rappahannock River Corrotoman River to Fredericksburg
12238,40000,Chesapeake Bay Mobjack Bay and York River Entrance
12241,20000,York River Yorktown and Vicinity
12243,40000,York River Yorktown to West Point
12244,40000,Pamunkey And Mattaponi Rivers
12245,20000,Hampton Roads
12248,40000,James River Newport News to Jamestown Island; Back River and College Creek
12251,40000,James River Jamestown Island to Jordan Point
12252,20000,James River Jordan Point to Richmond
12253,20000,Norfolk Harbor and Elizabeth River
12254,20000,Chesapeake Bay Cape Henry to Thimble Shoal Light
12255,5000,Little Creek Naval Amphibious Base
12256,20000,Chesapeake Bay Thimble Shoal Channel
12261,40000,"Chesapeake Bay Honga, Nanticoke, Wicomico Rivers and Fishing Bay"
12263,80000,Chesapeake Bay Cove Point to Sandy Point
12264,40000,Chesapeake Bay Patuxent River and Vicinity
12266,40000,Chesapeake Bay Choptank River and Herring Bay; Cambridge
12268,40000,Choptank River Cambridge to Greensboro
12270,40000,Chesapeake Bay Eastern Bay and South River; Selby Bay
12272,40000,"Chester River; Kent Island Narrows, Rock Hall Harbor and Swan Creek"
12273,80000,Chesapeake Bay Sandy Point to Susquehanna River
12274,40000,Head of Chesapeake Bay
12277,20000,Chesapeake and Delaware Canal
12278,40000,Chesapeake Bay Approaches to Baltimore Harbor
12280,200000,Chesapeake Bay
12281,15000,Baltimore Harbor
12282,25000,Chesapeake Bay Severn and Magothy Rivers
12283,10000,Annapolis Harbor
12284,10000,Patuxent River Solomons lsland and Vicinity
12285,80000,Potomac River; District of Columbia
12286,40000,Potomac River Piney Point to Lower Cedar Point
12287,20000,Potomac River Dahlgren and Vicinity
12288,40000,Potomac River Lower Cedar Point to Mattawoman Creek
12289,40000,Potomac River Mattawoman Creek to Georgetown;Washington Harbor
12300,400000,"Approaches to New York, Nantucket Shoals to Five Fathom Bank"
12304,80000,Delaware Bay
12311,40000,Delaware River Smyrna River to Wilmington
12312,40000,Delaware River Wilmington to Philadelphia
12313,15000,Philadelphia and Camden Waterfronts
12314,20000,Delaware River Philadelphia to Trenton
12316,40000,Intracoastal Waterway Little Egg Harbor to Cape May;Atlantic City
12317,10000,Cape May Harbor
12318,80000,Little Egg Inlet to Hereford Inlet;Absecon Inlet
12323,80000,Sea Girt to Little Egg Inlet
12324,40000,Intracoastal Waterway Sandy Hook to Little Egg Harbor
12325,15000,Navesink And Shrewsbury Rivers
12326,80000,Approaches to New York Fire lsland Light to Sea Girt
12327,40000,New York Harbor
12331,15000,Raritan Bay and Southern Part of Arthur Kill
12332,20000,Raritan River Raritan Bay to New Brunswick
12333,15000,Kill Van Kull and Northern Part of Arthur Kill
12334,10000,New York Harbor Upper Bay and Narrows-Anchorage Chart
12335,10000,Hudson and East Rivers Governors Island to 67th Street
12337,20000,Passaic and Hackensack Rivers
12338,5000,East River Newtown Creek
12339,10000,East River Tallman Island to Queensboro Bridge
12341,10000,Hudson River Days Point to George Washington Bridge
12342,10000,Harlem River
12343,40000,Hudson River New York to Wappinger Creek
12345,10000,Hudson River George Washington Bridge to Yonkers
12346,10000,Hudson River Yonkers to Piermont
12347,40000,Hudson River Wappinger Creek to Hudson
12348,40000,Hudson River Coxsackie to Troy
12350,20000,Jamaica Bay and Rockaway Inlet
12352,40000,Shinnecock Bay to East Rockaway Inlet
12353,80000,Shinnecock Light to Fire Island Light
12354,80000,Long Island Sound Eastern part
12358,40000,"New York Long Island, Shelter Island Sound and Peconic Bays;Mattituck Inlet"
12362,10000,Port Jefferson and Mount Sinai Harbors
12363,80000,Long Island Sound Western Part
12364,40000,Long Island Sound-New Haven Harbor Entrance and Port Jefferson to Throgs Neck
12365,20000,South Shore of Long Island Sound Oyster and Huntington Bays
12366,20000,Long Island Sound and East River Hempstead Harbor to Tallman Island
12367,20000,North Shore of Long Island Sound Greenwich Point to New Rochelle
12368,20000,North Shore of Long Island Sound Sherwood Point to Stamford Harbor
12369,20000,North Shore of Long Island Sound Stratford to Sherwood Point
12370,20000,North Shore of Long Island Sound Housatonic River and Milford Harbor
12371,20000,New Haven Harbor;New Haven Harbor (Inset)
12372,40000,Long Island Sound-Watch Hill to New Haven Harbor
12373,20000,North Shore of Long Island Sound Guilford Harbor to Farm River
12374,20000,North Shore of Long Island Sound Duck Island to Madison Reef
12375,20000,Connecticut River Long lsland Sound to Deep River
12377,20000,Connecticut River Deep River to Bodkin Rock
12378,20000,Connecticut River Bodkin Rock to Hartford
12401,15000,New York Lower Bay Southern part
12402,15000,New York Lower Bay Northern part
13003,1200000,Cape Sable to Cape Hatteras
13006,675000,West Quoddy Head to New York
13009,500000,Gulf of Maine and Georges Bank
13200,400000,Georges Bank and Nantucket Shoals
13203,220000,Georges Bank Western part
13204,220000,Georges Bank Eastern part
13205,80000,Block Island Sound and Approaches
13209,40000,Block Island Sound and Gardiners Bay; Montauk Harbor
13211,20000,North Shore of Long Island Sound Niantic Bay and Vicinity
13212,20000,Approaches to New London Harbor
13213,10000,New London Harbor and vicinity;Bailey Point to Smith Cove
13214,20000,Fishers Island Sound
13215,40000,Block Island Sound Point Judith to Montauk Point
13217,15000,Block Island
13218,80000,Marthas Vineyard to Block Island
13219,15000,Point Judith Harbor
13221,40000,Narragansett Bay
13223,20000,"Narragansett Bay, Including Newport Harbor"
13224,20000,Providence River and Head of Narragansett Bay
13225,10000,Providence Harbor
13226,20000,Mount Hope Bay
13227,10000,Fall River Harbor;State Pier
13228,20000,Westport River and Approaches
13229,40000,South Coast of Cape Cod and Buzzards Bay
13230,40000,Buzzards Bay; Quicks Hole
13232,20000,New Bedford Harbor and Approaches
13233,40000,Martha's Vineyard;Menemsha Pond
13235,5000,Woods Hole
13236,20000,Cape Cod Canal and Approaches
13237,80000,Nantucket Sound and Approaches
13238,20000,Martha's Vineyard Eastern Part;Oak Bluffs Harbor;Vineyard Haven Harbor;Edgartown Harbor
13241,40000,Nantucket Island
13242,10000,Nantucket Harbor
13244,40000,Eastern Entrance to Nantucket Sound
13246,80000,Cape Cod Bay
13248,20000,Chatham Harbor and Pleasant Bay
13249,20000,Provincetown Harbor
13250,40000,Wellfleet Harbor; Sesuit Harbor
13251,20000,Barnstable Harbor
13253,20000,"Harbors of Plymouth, Kingston and Duxbury; Green Harbor"
13260,378838,Bay of Fundy to Cape Cod
13267,80000,Massachusetts Bay; North River
13269,10000,Cohasset and Scituate Harbors
13270,25000,Boston Harbor
13272,10000,Boston Inner Harbor
13274,40000,Portsmouth Harbor to Boston Harbor; Merrimack River Extension
13275,25000,Salem and Lynn Harbors; Manchester Harbor
13276,10000,"Salem, Marblehead and Beverly Harbors"
13278,80000,Portsmouth to Cape Ann; Hampton Harbor
13279,20000,Ipswich Bay to Gloucester Harbor; Rockport Harbor
13281,10000,Gloucester Harbor and Annisquam River
13282,20000,Newburyport Harbor and Plum Island Sound
13283,20000,Portsmouth Harbor Cape Neddick Harbor to Isles of Shoals; Portsmouth Harbor
13285,20000,Portsmouth to Dover and Exeter
13286,80000,Cape Elizabeth to Portsmouth; Cape Porpoise Harbor; Wells Harbor; Kennebunk River; Perkins Cove
13287,20000,Saco Bay and Vicinity
13288,80000,Monhegan Island to Cape Elizabeth
13290,40000,Casco Bay
13292,20000,Portland Harbor and Vicinity
13293,40000,"Damariscotta, Sheepscot and Kennebec Rivers;South Bristol Harbor;Christmas Cove"
13295,15000,Kennebec and Sheepscot River Entrances
13296,15000,"Boothbay Harbor to Bath, Including Kennebec River"
13297,15000,Kennebec River Courthouse Point to Augusta
13298,15000,Kennebec River Bath to Courthouse Point
13301,40000,Muscongus Bay;New Harbor;Thomaston
13302,80000,Penobscot Bay and Approaches
13303,40000,Approaches to Penobscot Bay
13305,40000,Penobscot Bay;Carvers Harbor and Approaches
13307,20000,"Camden, Rockport and Rockland Harbors"
13308,15000,Fox Islands Thorofare
13309,40000,Penobscot River;Belfast Harbor
13312,80000,Frenchman and Blue Hill Bays and Approaches
13313,40000,Approaches to Blue Hill Bay
13315,20000,Deer Island Thorofare and Casco Passage
13316,40000,Blue Hill Bay;Blue Hill Harbor
13318,40000,Frenchman Bay and Mount Desert lsland
13321,10000,Southwest Harbor and Approaches
13322,10000,Winter Harbor
13323,10000,Bar Harbor Mount Desert Island
13324,40000,Tibbett Narrows to Schoodic Island
13325,80000,Quoddy Narrows to Petit Manan lsland
13326,40000,Machias Bay to Tibbett Narrows
13392,50000,Grand Manan Channel Southern Part
13394,50000,Grand Manan Channel Northern Part; North Head and Flagg Cove
13396,20000,Campobello Island; Eastport Harbor
13398,50000,Passamaquoddy Bay and St. Croix River; Beaver Harbor; Saint Andrews; Todds Point
14500,1500000,"Great Lakes, Lake Champlain to Lake of the Woods"
14770,15000,"Morristown, N.Y. to Butternut, Ont."
14771,15000,"Butternut Bay, Ont., to Ironsides l., N.Y."
14772,15000,"Ironsides l., N.Y., to Bingham l., Ont."
14773,15000,"Gananoque, Ont., to St. Lawrence Park. N.Y."
14774,15000,"Round I., N.Y., and Gananoque, Ont., to Wolfe I., Ont."
14781,40000,Riviere Richelieu to South Hero Island
14782,40000,Cumberland Head to Four Brothers Islands
14783,40000,Four Brothers Islands to Barber Point
14784,40000,Barber Point to Whitehall
14785,10000,Burlington Harbor
14786,nan,SMALL-CRAFT BOOK CHART New York State Canal System (book of 61 Charts)
14788,40000,Oneida Lake - Lock 22 to Lock 23
14791,60000,Cayuga and Seneca Lakes;Watkins Glen;Ithaca
14800,400000,Lake Ontario
14802,80000,Clayton to False Ducks ls.
14803,80000,Six Miles south of Stony Point to Port Bay;North Pond;Little Sodus Bay
14804,80000,Port Bay to Long Pond;Port Bay Harbor;Irondequoit Bay
14805,80000,Long Pond to Thirtymile Point;Point Breeze Harbor
14806,80000,"Thirtymile Point, N.Y., to Port Dalhousie, Ont."
14810,100000,Olcott Harbor to Toronto; Olcott and Wilson Harbors
14811,30000,"Chaumont, Henderson and Black River Bays;Sackets Harbor;Henderson Harbor;Chaumont Harbor"
14813,10000,Oswego Harbor
14814,10000,Sodus Bay
14815,10000,"Rochester Harbor, including Genessee River to head of navigation"
14816,30000,Lower Niagara River
14820,400000,Lake Erie
14822,80000,Approaches to Niagara River and Welland Canal
14823,80000,Sturgeon Point to Twentymile Creek;Dunkirk Harbor;Barcelona Harbor
14824,80000,Sixteenmile Creek to Conneaut;Conneaut Harbor
14825,80000,Ashtabula to Chagrin River;Mentor Harbor;Chagrin River
14826,80000,Moss Point to Vermilion;Beaver Creek;Vermilion Harbor;Rocky River
14828,100000,Erie to Geneva
14829,100000,Geneva to Lorain; Beaver Creek; Rocky River; Mentor Harbor; Chagrin River
14830,100000,West End of Lake Erie; Port Clinton Harbor; Monroe Harbor; Lorain to Detriot River; Vermilion
14832,30000,Niagara Falls to Buffalo
14833,15000,Buffalo Harbor
14835,15000,Erie Harbor
14836,5000,Ashtabula Harbor
14837,8000,Fairport Harbor
14838,120000,Buffalo to Erie;Dunkirk;Barcelone Harbor
14839,10000,"Cleveland Harbor, including lower Cuyahoga River"
14841,10000,Lorain Harbor
14842,nan,"SMALL-CRAFT BOOK CHART - Port Clinton to Sandusky, including the Islands (book of 35 charts)"
14843,5000,Huron Harbor
14844,40000,Islands in Lake Erie;Put-In-Bay
14845,10000,Sandusky Harbor
14846,nan,"SMALL-CRAFT BOOK CHART - West End of Lake Erie from Perrysburg, OH., of the Maumee R. to Huron R., Mich., and Bar Pt., Ont. (book of 34 charts)"
14847,20000,Toledo Harbor;Entrance Channel to Harbor
14848,30000,Detroit River
14850,60000,Lake St. Clair
14852,40000,St. Clair River;Head of St. Clair River
14853,nan,"SMALL-CRAFT BOOK CHART - Detoit River, Lake St. Clair and St. Clair River (book of 47 charts)"
14854,15000,Trenton Channel and River Rouge;River Rouge
14860,500000,Lake Huron
14862,120000,Port Huron to Pte aux Barques;Port Sanilac;Harbor Beach
14863,120000,Saginaw Bay;Port Austin Harbor;Caseville Harbor;Entrance to Au Sable River;Sebewaing Harbor;Tawas Harbor
14864,120000,Harrisville to Forty Mile Point;Harrisville Harbor;Alpena;Rogers City and Calcite
14865,15000,South End of Lake Huron
14867,20000,Saginaw River
14869,60000,Thunder Bay Island to Presque Isle;Stoneport Harbor;Resque Isle Harbor
14880,120000,Straits of Mackinac
14881,80000,Detour Passage to Waugoshance Pt.;Hammond Bay Harbor;Mackinac Island;Cheboygan;Mackinaw City;St. lgnace
14882,40000,St. Mars River - Detour Passage to Munuscong Lake;Detour Passage
14883,40000,St. Marys River - Munuscong Lake to Sault Ste. Marie
14884,40000,St. Marys River - Head of Lake Nicolet to Whitefish Bay;Sault Ste. Marie
14885,20000,Les Cheneaux Islands
14886,nan,"SMALL-CRAFT BOOK CHART - Inland Route, Cheboygan to Conway (book of 12 Charts)"
14887,20000,St Marys River - Neebish Island
14901,500000,Lake Michigan (Mercator Projection)
14902,240000,"North end of Lake Michigan, including Green Bay"
14903,120000,Algoma to Sheboygan;Kewaunee;Two Rivers
14904,120000,Port Washington to Waukegan;Kenosha;North Point Marina;Port Washington;Waukegan
14905,120000,Waukegan to South Haven;Michigan City;Burns International Harbor;New Buffalo
14906,120000,South Haven to Stony Lake;South Haven;Port Sheldon;Saugatuck Harbor
14907,120000,Stony Lake to Point Betsie;Pentwater;Arcadia;Frankfort
