Chart,Scale,Title
19369,20000,O?ahu South Coast Approaches to Pearl Harbor
19380,247482,O?ahu to Ni?ihau
19381,80000,Island of Kaua?i
19382,5000,Port Allen Island of Kaua?i
19383,5000,Kaua?i Nawiliwili Bay
19384,2000,Hanamaulu Bay Island of Kaua?i
19385,20000,North Coast of Kaua?i H??ena Point to Kepuhi Point
19386,10000,Kaua?i Approaches to Waimea Bay
19401,80000,French Frigate Shoals
19402,25000,French Frigate Shoals Anchorage
19421,100000,Gardner Pinnacles and approaches;Gardner Pinnacles
19441,80000,Maro Reef
19442,40000,Lisianski and Laysan Island;West Coast of Laysan Island
19461,40000,Pearl and Hermes Atoll
19480,180000,Gambia Shoal to Kure Atoll including approaches to the Midway Islands
19481,32500,Hawai?ian Islands Midway Islands
19482,10000,Hawai?ian Islands Midway Islands
19483,20000,Hawai?i Kure Atoll
25640,326856,Puerto Rico and Virgin Islands
25641,100000,Virgin Islands-Virgin Gorda to St. Thomas and St. Croix;Krause Lagoon Channel
25644,20000,Frederiksted Road;Frederiksted Pier
25645,10000,Christiansted Harbor
25647,15000,Pillsbury Sound
25649,10000,Saint Thomas Harbor
25650,100000,Virgin Passage and Sonda de Vieques
25653,20000,Isla de Culebra and Approaches
25654,6500,Ensenada Honda
25655,10000,Ensenada Honda to Canal de Luis Pena
25659,20000,Puerto Maunabo
25661,10000,Puerto Yabucoa
25663,40000,Pasaje de San Juan to Puerto de Humacao and Western Part of lsla de Vieques
25664,25000,Pasaje de Vieques and Radas Roosevelt
25665,20000,Punta Lima to Cayo Batata
25666,10000,Ensenada Honda
25667,10000,Bahia de Fajardo and Approaches
25668,100000,North Coast of Puerto Rico Punta Penon to Punta Vacia Talega;Puerto Arecibo;Puerto Palmas Altas
25669,20000,Approaches to San Juan Harbor
25670,10000,Bahia de San Juan
25671,100000,West Coast of Puerto Rico
25673,15000,Bahia de Mayaguez and approaches
25675,10000,Bahia de Boqueron
25677,100000,South Coast of Puerto Rico Guanica Light to Punta Tuna Light;Las Mareas
25679,10000,Bahia de Guanica
25681,10000,Bahia de Guayanilla and Bahia de Tallaboa
25683,20000,Bahia de Ponce and Approaches
25685,20000,Punta Petrona to lsla Caja de Muertos
25687,20000,Bahia de Jobos and Bahia de Rincon
25689,20000,Puerto Arroyo
26194,15000,Navassa Island
411,2160000,Gulf of Mexico
4148,470940,Havana to Tampa Bay
50,10000000,North Pacific Ocean (eastern part) Bering Sea Continuation
500,3500000,West Coast Of North America Dixon Ent To Unimak Pass
501,3500000,North Pacific Ocean West Coast Of North America Mexican Border To Dixon Entrance
513,3500000,Bering Sea Southern Part
514,3500000,Bering Sea Northern Part
5161,1058400,"Newport, Rhode Island to Bermuda (Plotting Sheet)"
530,4860700,North America West Coast San Diego to Aleutian Islands and Hawai?ian Islands
531,2100000,Gulf of Alaska Strait of Juan de Fuca to Kodiak Island
540,3121170,Hawai?ian Islands
81004,931650,Commonwealth of the Northern Mariana Islands
81048,100000,Mariana Islands Island of Guam Territory of Guam;Cocos Lagoon
81054,10000,"Mariana Islands Apra Harbor, Guam"
81063,25000,Commonwealth of the Northern Mariana Islands Rota
81067,75000,Commonwealth of the Northern Mariana Islands Saipan and Tinian
81071,20000,"Commonwealth of the Northern Mariana Islands Bahia Laolao, Saipan Island and Tinian Harbor, Tinian Island"
81076,12000,Commonwealth of the Northern Mariana Islands Saipan Harbor
81086,45000,Plans in the Mariana Islands; Faraloon de Pajaros; Sarigan Island; Farallon de Medinilla; Ascuncion Island; Agrihan; Agrihan Anchorge; Alamagan Island; Guguan; Anatahan
81092,25475,Commonwealth of the Northern Mariana Islands
81664,15000,Wake Island;Wake Island Boat Basin
83116,15000,"Islands in the Pacific Ocean-Jarvis, Bake and Howland Islands"
83153,25000,United States Possesion Kingman Reef
83157,10000,Palmyra Atoll;Approaches to Palmyra Atoll
83484,60000,U.S. Possessions in Samoa Islands Manua Islands;Pago Pago Harbor;Tutuila Island;Rose Atoll;Swains Island
83633,200000,United States Possession Approaches to Johnston Atoll
83637,nan,Johnston Atoll;Johnston Island Harbor
